,中文,英文,日文
Title,會議廳,The Conference Room,会議ホール
Content,"一走進會議廳、很快就會被中央大型的橢圓形會議桌所深深吸引。當年蔣介石總統就是常常利用這裡與文武將領們舉行軍事會議。這是一間非常專業的會議廳，正前方的布幕後面隱藏著一個自動簡報系統，有一個大小、功能類似一般小型電影院的螢幕。為提高會議流程，裡面還精心設計了12層電動自走式活動看板。開會前，可事先將簡報資料、圖表、或是軍事地圖黏貼在不同的看板上面，方便蔣總統在開會討論時、很快地依議程拉開、進行說明解說。

會議廳約120坪與對面的會客廳的大小相同，這裡可同時容納80到100位的與會貴賓。而眼前的會議桌、也可依照不同需要、改變位置與造形。在這裡招待過無數的貴賓、其中包括金龍少棒隊的可愛小棒球選手、9次打破世界紀錄的飛躍羚羊紀政、以及榮獲奧運十項運動銀牌的亞洲鐵人楊傳廣……，他們都曾經是這裡的座上貴賓 !
","Upon entering the Conference Room, anyone would be immediately attracted by the giant oval table. This is where President Chiang Kai-shek used to hold military meetings.

The Conference Room occupies about 120 square meters, about the same size as the Reception Room on the opposite side. It can accommodate 80 to 100 guests, and the oval table can be adjusted its position and shape according to different needs. At present, this Conference Room is open for public rental.","　会議ホールに足を踏み入れますと、すぐに目に付くのが中央に置かれている大型の楕円形のテーブルです。かつて、蒋介石総統はこの場所に文官・武官を集めて軍事会議を行いました。このホールの設備は大変優れており、テーブル隣のカーテンの奥には大小二つのスクリーンと、会議の効率を高めるために設計された十二の画面が投影できる投影機が設置されています。会議が開かれる前に報告用の資料や図表、あるいは地図などを異なる画面に貼り付け、蒋介石総統が会議を行う際、すぐに説明できるようになっていました。
　会議ホールは約120坪あり、向かいにある応接ホールと同じ大きさです。このホールは一度に八十から百名を収容できます。ご覧になっているテーブルは使用する場面に応じて位置や形を変えることができます。このホールではこれまで数々の来賓をもてなしてきましたが、その中には数多くの台湾スポーツ史に名をとどめたスポーツ選手が含まれています。
"
Image01,展品01照片01,Photo01,展品01照片01日文
Image02,展品01照片02,Photo02,展品01照片02日文
Image03,展品01照片03,Photo03,展品01照片03日文
Image04,展品01照片04,Photo04,展品01照片04日文
Image05,展品01照片05,Photo05,展品01照片05日文
Image06,展品01照片06,Photo06,展品01照片06日文