,中文,英文,日文
Title,曾后希《子貢連騎》圖,Tseng Ho-si’s Zi Gong Riding Horses,曽后希「子貢連騎」図
Content,"    看圖中央的四匹馬,真讓人感到可惜 ! 因為硫磺氣將「白馬」薰成了「青馬」!這件《子貢連騎圖》是畫家曾后希所精心繪製而成的。畫中描繪著《史記》孔子<弟子傳>裡子貢與原憲發生的一段精彩故事。

   自從孔子去世後，優秀的弟子原憲流亡隱居在衛國的郊外。身為衛國宰相的子貢知道以後,便火速地前往探視他。畫家精湛的烘染技巧、將車馬眾多及塵土飛揚的氣氛，表現得無懈可擊!同時曾后希還刻意地將故事的情節隱藏其中。其畫中故事大意為子貢身著華服，乘著高大馬車來見原憲，見到原憲生活清苦，衣著破爛，便問原憲所生何病。豈知原憲安貧樂道，不肯與世俗同流合汙的態度，使子貢相當羞愧,後悔自己的言行。","This painting, Zi Gong Riding Horses, is drawn by Tseng Ho-si. It depicts the story  in Shiji (Historical Records). It is a pity that in the center of this painting, as a result of sulfur, the four white horses are “burnt” and thus become blue horses.","  作品中央の四匹の馬は、見る者を惜しい気持ちにさせます。それは硫黄が「白馬」を「青馬」にしてしまったからです。この「子貢連騎図」は画家曽后希が丹精込めて描いたものです。この作品は「史記」における孔子の「弟子伝」中の子貢と原憲の間に起った素晴らしい物語を描いています。

  孔子がこの世を去った後、優秀な弟子であった原憲は衛国の郊外に流れ着いて隠居していました。衛国の宰相であった子貢はそれを知った後、すぐさま原憲に会いに行きました。画家の巧みな筆さばきにより、車馬の多さと埃立つ雰囲気が完璧に表現されています。同時に曽后希は絵の中に物語の筋を巧みに隠しています。この絵において描かれている物語は宰相になった子貢が豪華な服を着て原憲に会いに行き、その生活が貧しいのを見て病気をしていないか尋ねたところ、原憲は貧しい生活を楽しみ、堕落した世の中に迎合しないと答えました。それを聞いた子貢は自らを恥じ、その言動を後悔したというものです。"
Image01,展品01照片01,Photo01,展品01照片01日文
Image02,展品01照片02,Photo02,展品01照片02日文
Image03,展品01照片03,Photo03,展品01照片03日文
Image04,展品01照片04,Photo04,展品01照片04日文
Image05,展品01照片05,Photo05,展品01照片05日文
Image06,展品01照片06,Photo06,展品01照片06日文