,中文,英文,日文
Title,臺北國父史蹟紀念館模型,An Architectural Model of Taipei’s Historical Memorial Hall of Dr. Sun Yat-sen,台北国父史蹟記念館模型
Content,"看到這件<國父史蹟紀念館模型>,是不是覺得好像曾經在哪裡見過?國父史蹟紀念館位於現在台北火車站附近的「逸仙公園」位置。為什麼今日成為「國父史蹟紀念館」,是因為民國2年(1913)“二次革命”討袁失敗後,當時國父搭船來到台灣。就下榻暫住於台北御成町的“梅屋敷”旅社。國父曾在這裡。揮毫『同仁』『博愛』橫披致贈旅館主人大和宗吉。由於深具歷史價值意義,民國35年(1946)政府將此處定名為「國父史蹟紀念館」。趁著中國國民黨建黨60周年之際,先總統蔣公在館內建碑紀念,並親題『匡復中華的起點,重建民國的基地』。但在民國72年(1983)配合鐵路地下化工程,向北搬移了50公尺。而這座日本式建築風格的“梅屋敷” 旅社,就成為今日台灣的「國父史蹟紀念館」。","The Model of the Historical Memorial Hall of Dr. Sun Yat-sen is representing the one located in Yat-sen Park nearby Taipei Railway Station. In 1913, after an aborted “Second Revolution,” Dr. Sun Yat-sen took a ship to Taiwan, living at Mei Wu Fu Hotel. On behalf of its historical significance, it was named Historical Memorial Hall of Dr. Sun Yat-sen in 1946.

Normally, architectural models are made according to the rate 1:200. Mr. Lin Mu-chuan, with expertise on sculpture, is especially good at exploring details. Therefore, his model adopts the 1:50 rate in order that visitors can have a clearer look. This wooden, rectangular traditional Japanese-style architectural model is exactly an imitation of Mei Wu Fu Hotel. When watching this model, don’t overlook the small artifacts or scenic spots on which Mr. Lin very much concentrates.","この模型の建物をご覧になったことがあるでしょうか。国父史跡記念館は台北駅近くの「逸仙公園」にあります。どうしてこの場所が「国父史跡記念館」になっているのでしょうか?
  1913年に二回目の革命に失敗した孫文は台湾へやってきました。そして当時台北市御成町にあった「梅屋敷旅館」に宿泊しました。孫文はここで「博愛」、「同仁」などの言葉を揮毫してこの旅館の主人に送りました。この建物はこのような歴史を持つため、1946年、政府はこの建物に歴史的意義があるとして、この旅館跡を「国父史跡記念館」としました。そして、中国国民党が60周年を迎えた際には、蒋介石総統によって館内に記念碑が設置されした。そして1983年には台湾鉄道の地下化工事に伴い、北側へ50m移動しました。日本統治時代に「梅屋敷旅館」であったこの日本建築は、今日台湾の「国父史跡記念館」となっています。"
Image01,展品01照片01,Photo01,展品01照片01日文
Image02,展品01照片02,Photo02,展品01照片02日文
Image03,展品01照片03,Photo03,展品01照片03日文
Image04,展品01照片04,Photo04,展品01照片04日文
Image05,展品01照片05,Photo05,展品01照片05日文
Image06,展品01照片06,Photo06,展品01照片06日文