,中文,英文,日文
Title,蔣中正及蔣經國總統父子像,Chiang Kai-shek and Chiang Ching-kuo: Father and Son,蒋介石と蒋経国親子の像
Content,"這兩位總統立像，是在民國77年(1988)蔣經國總統過世後，同年的7月4日特別委請雕塑大師楊國君先生以玻璃纖維翻製模型所製作的。為了避免硫磺氣氧化的傷害，兩位總統立像和大廳的國父坐像的材質一樣都是玻璃纖維製作的。雖然不是使用金屬材料，但乍看之下，兩位總統立像的外觀，是不是覺得和青銅像接近、沒有太大差別！精神奕奕、閃耀著愛護傳統與經營台灣的光芒。

接著再麻煩您抬頭看看天花板上的這幾座宮燈，四角裝飾蝙蝠、加上正中央的福字，暗示著｢五福臨門｣的吉祥意思。

今日本館刻意地將雕像放在＂繼往開來＂的匾額前面。不僅是為了紀念兩位總統秉承國父遺訓，努力發展革命精神，繼往開來的意思。同時他們倆人一前一後、前仆後繼地擺置，有如為後人開啟中華文化與國家民族命脈的傳承的勇者形象。
","These two statues were commissioned to sculptor Yang Kuo-jung, who was famous for his glass fiber technique. It is no surprise that the purpose of using glass fiber was to fight against sulfur. Now, we move to the two President Statues in front of the sign board “Inherit the past, initiate the future.”

Next, please look at the palace lanterns on the ceiling. Their four corners are decorated with bats; in the middle, there is a Chinese word Fu, which is a homonym with bats. All these efforts are made to assure fortune will arrive at this door.","　この二人の総統の立像は1988年に蒋経国総統が亡くなった後、その年の7月4日、彫刻の大家楊国君氏に依頼して制作されたものです。この立像は一階ロビーの孫文像と同じく、グラスファイバーによって制作されています。金属製ではありませんが、青銅製の銅像と大差ない外観になっています。伝統を守り、台湾を支えていこうとする精神に溢れている表情をしています。
　次に天井をご覧ください。天井には宮灯が設置されていますが、中国語で縁起のよい言葉とされているコウモリと福の字の装飾が施されています。
　この像の上にかけられている額をご覧ください。この額の字は先人の事業を受け継ぎ、更に発展させるという意味です。これはこの二人の総統が国父孫文の意思を受け継ぎ革命精神を発展させたことを記念しています。また、この像は父蒋介石と子の蒋経国が前後に並んだ形で設置されています。これは中華文化と国家を守り発展させ続けるという意味を持っています。
"
Image01,展品01照片01,Photo01,展品01照片01日文
Image02,展品01照片02,Photo02,展品01照片02日文
Image03,展品01照片03,Photo03,展品01照片03日文
Image04,展品01照片04,Photo04,展品01照片04日文
Image05,展品01照片05,Photo05,展品01照片05日文
Image06,展品01照片06,Photo06,展品01照片06日文