,中文,英文,日文
Title,國宴廳概述,The State Banquet Room,国宴庁の概略
Content,"三樓的大餐廳又名為「國宴廳」。因為自啟用後,這裡就成為我國總統舉行國宴、招待各國元首大使的地方。同時也是國大代表開會期間用餐的場所。為了呈現「國宴廳堂」的風貌,無論是地毯、餐桌、座椅、餐具、菜色、食譜... 都是專為國宴所精心訂製的。集合各地大廚親自掌廚,桌上菜色、處處展現中華美食的風采。

具有經驗的館員說:當舉行國宴的時候,中央的舞台還會委託花藝家們,用假山雅石、奇木花卉進行布置。在此享受美食的同時,一邊不僅有現場國樂演奏,一旁還有專人介紹國宴茶湯與菜色。請您置身在11米高、34米寬的無跨距空間裡,感受一下招待者無上至高的敬意與誠心。

宮燈

請您抬頭仰望、看看這裡的宮燈,中山樓的大宮燈就懸掛在這裡;每個宮燈長寬近2.4米、幾乎比家用的雙人床都還要大。當時建築師考慮安全的問題,刻意地將這些大燈們一一的固定在屋頂的主梁上、反覆的安檢測試、既堅固又牢靠。

宮燈真的很大 ! 如果平日需要更換燈泡,工作人員還得站在燈裡、才能進行更換維修呢!

梅花稻穗

看一下牆上的裝飾,有龍紋、鳳紋、如意紋...等彩繪,金碧輝煌的色調,展現著尊榮、富貴與吉祥的氣氛。民國53年(1964)行政院決議將梅花訂為國花之後,從此梅花也成為中華民國精神的象徵。看看前後主牆的中央,裝飾著一層樓高的巨型「梅花稻穗」。梅開五瓣,象徵五族共和,豐滿的稻穗也代表著國泰民安、五穀豐登。

多變的四方餐桌

再看看這些排列整齊的四方型餐桌,它們是一種多功能用途的餐桌。簡潔優雅的桌型、結合著東方人文與西方風華的巧思。一張桌子配10張椅子,很多人不禁好奇的問 : 這麼小的桌子怎麼坐得下10個人?原來它們是中西融合的多功能用途餐桌。可圓、可方的設計,因應中西不同的國宴需要可以自行改變。將方桌並在一起,這個空間馬上就可以變成西式宴會的場所。若是加上一片片圓形的桌面、則變身為傳統古典的中式餐廳。

看看地板,您是否發現這些整齊的桌子,原來是依照地上的地板線索排列而成,有了線來做參考,因此也節省了許多排列、收拾的時間。","The third floor’s restaurant is more often called “state banquet” room because, since its opening, it was the place where presidents held state banquets and entertained foreign presidents and ambassadors. In addition, this was also the dining place when delegates were holding National Assembly. 

In order to meet the standard of state banquets, this room was particularly designed for holding ceremonious feasts, including carpets, tables, chairs, tableware, menu, recipes, etc. Chefs around Taiwan were honored having chance to present Chinese gastronomy. 

Palace Lanterns

Please look up! The legendary palace lanterns are right above you. Each has almost 2.4 meters by length and by width. This is larger than a queen size bed. Palace are definitely gigantic. When changing bulbs, the staff member has to stand “inside” the lantern!

Plum Blossom and Ears of Rice 

In 1964, Executive Yuan passed a resolution assigning plum blossom as National Flower. Since then, plum blossom has become a symbol of national spirit. Look! In the center of the front wall and the back wall, there is a colossal installation of “Plum Blossom and Ears of Rice.” There are five petals in plum blossom, signifying that five peoples can live together. And the harvest of rice grains represents a land of promise and prosperity.

A Versatile Square Table

These neatly lined-up square tables are truly versatile. Their simplicity and sophistication reflect both eastern and western mindsets. Each table is accompanied by ten chairs. Many of you might wonder: how can such a small table accommodate ten persons? Indeed, these tables, being square or being round, demonstrate their flexible application. On western-style occasions, they can be juxtaposed together, extended to be a long, rectangular dining table. On domestic occasions, adding a round plate will help them turn out to be a traditional Chinese dining setting.

There lies another story on the floor. Look at these floor lines! With these neat lines, when resetting the restaurant, they have reference to get tables lined up. It’s an efficient, time-saving idea.","三階の大食堂は「国宴庁」と呼ばれています。それはここが歴代の総統が各国の元首を招いて晩餐会などを開く場所であったからです。そして国民大会開会中にはレストランとしても使用されていました。晩餐会に使用する雰囲気をかもし出すため、じゅうたん・食卓・椅子・食器・メニューのすべてに細心の注意が払われていました。各地から有名なシェフが集合して調理を指揮し、食卓に上るメニューはすべて中華料理の素晴らしさを伝えるものでした。

  ベテラン職員の話によれば、かつて政府主催の晩餐会が開かれる際には、中央の舞台は専門家に依頼して花や草木で飾り立てたそうです。ここでは素晴らしい料理を楽しむだけでなく、中国音楽の生演奏も行われ、それだけでなく中国茶や料理の紹介も行われたそうです。高さ11m、幅34mの空間で、かつて行われた最高のもてなしを感じてみてください。

宮灯

  天井にある宮灯をごらんください。中山楼の大型宮灯はここに設置されています。それぞれの宮灯の大きさは2.4m近くあり、家庭用ダブルベッドより更に大きいのです。建設当時、設計者は安全性を考慮し、これらの照明を屋根内部の梁に固定し、耐久性に問題ないように何度も安全検査を行いました。また、この宮灯は大変大きいため、電球を交換する際、作業員は宮灯の中に入って作業しなければなりません。

梅花と稲穂のレリーフ

  壁の上の装飾をご覧ください。龍や鳳をモチーフとした図柄や光り輝く色調は栄誉や富貴、そして縁起よい雰囲気をかもし出しています。1964年に行政院は梅の花を国の花に指定し、梅は中華民国の精神的象徴となりました。前後の壁の中央をご覧ください。大変大きな「梅花と稲穂」のレリーフが設置されています。梅の五つの花びらは民族の協和を象徴し、よく実った稲穂は国の安泰と農作物の豊作を象徴しています。

さまざまに変わる四角形食卓

  この整然と並べられた四角形の食卓をご覧ください。この食卓はさまざまな働きを持つ食卓であり、東洋と西洋の巧みな知恵が結合したシンプルかつ優雅な食卓です。一つの食卓には十組の椅子が配置されています。こんなに小さい食卓にどうやって十人も座るのだろうと不思議に思われることでしょう。この食卓は東西の文化が融合したさまざまな働きを持っています。丸くしても四角形でも使用でき、東洋と西洋それぞれ異なる国のニーズによって形を変えることができます。四角形の状態で並べれば、このスペースはすぐさま西洋式パーティーの会場となります。もし丸い状態で使用すれば、伝統的な中国式宴会場となります。

  床をご覧ください。この整然と並べられた食卓は床に引かれた線に沿って並べられていることに気づかれたでしょうか。この線を参考にすれば並べたり片付ける手間を大幅に節約できます。"
Image01,展品01照片01,Photo01,展品01照片01日文
Image02,展品01照片02,Photo02,展品01照片02日文
Image03,展品01照片03,Photo03,展品01照片03日文
Image04,展品01照片04,Photo04,展品01照片04日文
Image05,展品01照片05,Photo05,展品01照片05日文
Image06,展品01照片06,Photo06,展品01照片06日文