,中文,英文,日文
Title,三樓圓廳概述,The Circular Room on the Third Floor,三階円形ホールの概略
Content,"    三樓的圓廳顧名思義,有別於其他方形的廳室。從天花板到地板、都是呈現圓弧形的樣態,所以在家具的陳設上、也大都選了一些圓形或帶弧形的家具。看看中間的大圓桌、底下配著梅花形的矮凳,以及周邊所有的家具感覺上都是配合圓弧形進行擺設。廳內牆壁上掛著四件台灣玉與珊瑚組合成的四季掛飾,將圓廳妝點得格外清雅、脫俗。

    圓廳素來被雅稱為「中山樓的顏面」,主要作為招待來賓品茗、下棋或談心的地方。過去造訪中山樓的貴賓,必定會被邀請上來參觀。以前在李登輝總統就職當天,就邀請了14位友邦元首上來這裡圍聚品茗、欣賞陽明山獨特的自然景致。

    另外,這裡值得一提的就是門口的兩張「龍椅」,請您走向前去 !

    欣賞這張「龍椅」獨特的紋飾、似龍像鳳,龍鳳合體,別具特色。這兩張「龍椅」在過去國民大會期間,每逢國大集會就會被搬到一樓文化堂舞台,作為議長專用的座椅。
","As the name of the room reminds us, all throughout this room—from the ceiling to the floor—everything is either circle or circular arc. Look at the round table in the center; underneath the table are plum-shape stools. The entire setting repeats the motif of circle and circular arc. On the wall, there are four seasonal drop ornaments composed of Taiwanese jade and coral, leaving the room a refined sense of beauty.

The Circular Room used to be called “the Face of Chungshan Hall,” In the past, all VIPs who visited Chungshan Hall would be invited upstairs. 

Notice the two dragon chairs beside the door. Please walk ahead. The decorative motif of this dragon chair resembles either dragons or phoenixes, or the fusion of both. The dragon chair, also called emperors’ chair, used to appear in emperors’ special ceremonies. During the period of National Assembly, these two dragon chairs would be moved to the Hall of Chinese Culture as the chair special for the chairman.","三階の円形ホールはその名の通り、他のホールとは違い、天井から床まで、すべて円形で丸みを帯びています。ですから設置する家具についても、ほとんど円形または丸みを帯びた形の家具が使われています。中央にある大円卓をご覧ください。梅の花の形をかたどった椅子が組み合わされています。そしてこの部屋に置かれている家具は円の形に配置されています。ホール内の壁には台湾ヒスイとサンゴを組み合わせた四季をイメージした装飾品が掛けられており、このホールを更に優雅かつ上品にしています。

  円形ホールは「中山楼の顔」と言われており、来賓が中国茶を楽しんだり、中国将棋やおしゃべりをする場所として使われてきました。かつて中山楼にいらっしゃった来賓は必ずこのホールを参観されました。李登輝総統の就任式典の当日、十四名の国家元首の来賓がこのホールで中国茶と陽明山独特の自然景観を楽しまれたのです。

 また、このホールの入り口には二つの玉座があります。

  この玉座には龍でもあり鳳凰でもあるような独特の模様が施されています。この二つの玉座は以前、国民大会の期間中になると、一階の文化堂の舞台へ運ばれ、議長専用の椅子として使用されました。"
Image01,展品01照片01,Photo01,展品01照片01日文
Image02,展品01照片02,Photo02,展品01照片02日文
Image03,展品01照片03,Photo03,展品01照片03日文
Image04,展品01照片04,Photo04,展品01照片04日文
Image05,展品01照片05,Photo05,展品01照片05日文
Image06,展品01照片06,Photo06,展品01照片06日文